{"controller_truth":{"acceptable_assumptions":["Only the committed public repository fixture is authoritative."],"decision_seams":["Choose where ownership or idempotency becomes authoritative."],"deterministic_checks":{"checks":["Reproduce the old interleaving under a bounded stress harness","Verify exactly-once observable output across retries"],"strategy_flexible":true,"valid_strategy_ids":["atomic_ownership","idempotency_key"]},"forbidden_actions":["Do not suppress duplicates only at the presentation layer","Do not invent unavailable private context or credentials."],"metamorphic":{"acceptable_decision_equivalence_set":["atomic_ownership","idempotency_key"],"transforms":["reorder non-authoritative context"],"variant_of":"GROUP-recurring_bug"},"risks":["A deterministic-looking test can miss the actual interleaving."],"rubric_anchors":{"evidence_grounding":"Separates snapshot facts from assumptions.","executability":"Orders checks before irreversible action.","intent_fidelity":"Preserves the authoritative task and non-goal.","risk_and_rollback":"Names the causal risk and a verified rollback."},"truth_set":{"must":["Identify and falsify the causal concurrency hypothesis","Add a regression test that fails on the unpatched race"],"non_goals":["Do not suppress duplicates only at the presentation layer"],"should":["Separate root-cause evidence from timing coincidence"]}},"difficulty":"standard","id":"DEV-recurring-bug-03","planner_input":{"budget":{"planner_tokens":8000,"time_seconds":900,"tool_calls":20},"clarification_oracle":{"allowed_answer_hash":null,"question":null,"required":false},"context_bundle":[{"authority":"authoritative","content":"Do not suppress duplicates only at the presentation layer","kind":"constraint"},{"authority":"authoritative","content":"Plan a root-cause repair for an intermittent duplicate event bug that survived an earlier symptom-only patch.","kind":"request"},{"authority":"authoritative","content":"Public repository fixture: an intermittent state-recovery defect has two prior symptom-only patches. The durable plan must identify the authority boundary, reproduce the failure, add a falsifiable regression test, and preserve valid recovery behavior.","kind":"repository_fact"}],"source_snapshots":[{"content":"Public repository fixture: an intermittent state-recovery defect has two prior symptom-only patches. The durable plan must identify the authority boundary, reproduce the failure, add a falsifiable regression test, and preserve valid recovery behavior.","immutable":true,"locator":"git+https://github.com/evgyur/chip-supergoal.git@debffb5b9c07d4acdfeaa708c0fbd67358e97632:evals/corpus/sources/recurring_bug.txt","sha256":"eb77fa845f454c57a325252b2f165a7ae63e7c0411ed6dfacd50f4e04f6b99c6"}],"task":"Plan a root-cause repair for an intermittent duplicate event bug that survived an earlier symptom-only patch."},"privacy_class":"public_repository","schema_version":"eval-case-v2","source_class":"public_repo","split":"development","stratum":"recurring_bug"}
