{"controller_truth":{"acceptable_assumptions":["Only the committed public repository fixture is authoritative."],"decision_seams":["Choose the narrow adapter boundary and rollback switch."],"deterministic_checks":{"checks":["Run the legacy integration suite unchanged","Exercise signature, retry, and rollback fixtures"],"strategy_flexible":true,"valid_strategy_ids":["thin_adapter","feature_gated_extension"]},"forbidden_actions":["Do not redesign the entire service or transport stack","Do not invent unavailable private context or credentials."],"metamorphic":{"acceptable_decision_equivalence_set":["thin_adapter","feature_gated_extension"],"transforms":["rename entities and files"],"variant_of":"GROUP-brownfield_integration"},"risks":["A locally clean integration can silently break retry or signature semantics."],"rubric_anchors":{"evidence_grounding":"Separates snapshot facts from assumptions.","executability":"Orders checks before irreversible action.","intent_fidelity":"Preserves the authoritative task and non-goal.","risk_and_rollback":"Names the causal risk and a verified rollback."},"truth_set":{"must":["Preserve existing webhook behavior and public interfaces","Bind every change to executable compatibility and failure-path checks"],"non_goals":["Do not redesign the entire service or transport stack"],"should":["Prefer an adapter at the existing integration seam"]}},"difficulty":"standard","id":"DEV-brownfield-integration-02","planner_input":{"budget":{"planner_tokens":8000,"time_seconds":900,"tool_calls":20},"clarification_oracle":{"allowed_answer_hash":null,"question":null,"required":false},"context_bundle":[{"authority":"authoritative","content":"Plan a backward-compatible webhook integration in an existing service without replacing its current transport layer.","kind":"request"},{"authority":"authoritative","content":"Public repository fixture: a mature package keeps a legacy compatibility adapter enabled by default. A new integration must use the documented extension seam, preserve profile-off byte behavior, add rollback, and avoid replacing the adapter wholesale.","kind":"repository_fact"},{"authority":"authoritative","content":"Do not redesign the entire service or transport stack","kind":"constraint"}],"source_snapshots":[{"content":"Public repository fixture: a mature package keeps a legacy compatibility adapter enabled by default. A new integration must use the documented extension seam, preserve profile-off byte behavior, add rollback, and avoid replacing the adapter wholesale.","immutable":true,"locator":"git+https://github.com/evgyur/chip-supergoal.git@debffb5b9c07d4acdfeaa708c0fbd67358e97632:evals/corpus/sources/brownfield_integration.txt","sha256":"35dcec6727a3f71e2fccd7f5caeb179c70fc63400020c88921671839287bfe84"}],"task":"Design a plan for a backward-compatible webhook integration in an brownfield service without replacing its current transport layer."},"privacy_class":"public_repository","schema_version":"eval-case-v2","source_class":"public_repo","split":"development","stratum":"brownfield_integration"}
