{"controller_truth":{"acceptable_assumptions":["Only the committed public repository fixture is authoritative."],"decision_seams":["Choose the authoritative read/write transition and reconciliation point."],"deterministic_checks":{"checks":["Replay mixed-version reads and writes on a snapshot","Verify rollback before contract-phase deletion"],"strategy_flexible":true,"valid_strategy_ids":["dual_write_with_reconcile","shadow_copy_with_cutover"]},"forbidden_actions":["Do not perform a one-shot replacement of production data","Do not invent unavailable private context or credentials."],"metamorphic":{"acceptable_decision_equivalence_set":["dual_write_with_reconcile","shadow_copy_with_cutover"],"transforms":["reorder non-authoritative context"],"variant_of":"GROUP-architecture_migration"},"risks":["Dual writes can drift and make rollback lossy."],"rubric_anchors":{"evidence_grounding":"Separates snapshot facts from assumptions.","executability":"Orders checks before irreversible action.","intent_fidelity":"Preserves the authoritative task and non-goal.","risk_and_rollback":"Names the causal risk and a verified rollback."},"truth_set":{"must":["Define an ordered expand-migrate-contract sequence","Prove rollback and mixed-version compatibility before destructive cleanup"],"non_goals":["Do not perform a one-shot replacement of production data"],"should":["Make the cutover authority explicit and observable"]}},"difficulty":"standard","id":"DEV-architecture-migration-03","planner_input":{"budget":{"planner_tokens":8000,"time_seconds":900,"tool_calls":20},"clarification_oracle":{"allowed_answer_hash":null,"question":null,"required":false},"context_bundle":[{"authority":"authoritative","content":"Do not perform a one-shot replacement of production data","kind":"constraint"},{"authority":"authoritative","content":"Plan an incremental data-model migration while old and new readers must coexist and rollback remains possible.","kind":"request"},{"authority":"authoritative","content":"Public repository fixture: migration from schema v2 to v3 must preserve old readers during a bounded transition. The repository exposes a projection layer, an atomic state transition command, and an explicit rollback checkpoint.","kind":"repository_fact"}],"source_snapshots":[{"content":"Public repository fixture: migration from schema v2 to v3 must preserve old readers during a bounded transition. The repository exposes a projection layer, an atomic state transition command, and an explicit rollback checkpoint.","immutable":true,"locator":"git+https://github.com/evgyur/chip-supergoal.git@debffb5b9c07d4acdfeaa708c0fbd67358e97632:evals/corpus/sources/architecture_migration.txt","sha256":"43ac39dc3d95b418af79c0874bb3b36a09ba0393417f49c021a25049d82137b7"}],"task":"Plan an incremental data-model migration while old and new readers must coexist and rollback remains possible."},"privacy_class":"public_repository","schema_version":"eval-case-v2","source_class":"public_repo","split":"development","stratum":"architecture_migration"}
