{"controller_truth":{"acceptable_assumptions":["Only the committed public repository fixture is authoritative."],"decision_seams":["Choose the platform-neutral contract and native evidence boundary."],"deterministic_checks":{"checks":["Compare clean package fingerprints across repeated builds","Run path, lock, and archive fixtures on native Windows"],"strategy_flexible":true,"valid_strategy_ids":["native_matrix_gate","signed_platform_receipts"]},"forbidden_actions":["Do not claim Windows support from a Linux compatibility layer","Do not invent unavailable private context or credentials."],"metamorphic":{"acceptable_decision_equivalence_set":["native_matrix_gate","signed_platform_receipts"],"transforms":["express the class objective directly"],"variant_of":"GROUP-cross_platform_release"},"risks":["Path, locking, and archive semantics can diverge by platform."],"rubric_anchors":{"evidence_grounding":"Separates snapshot facts from assumptions.","executability":"Orders checks before irreversible action.","intent_fidelity":"Preserves the authoritative task and non-goal.","risk_and_rollback":"Names the causal risk and a verified rollback."},"truth_set":{"must":["Run clean native checks on Linux and supported Windows Python versions","Bind package identity and release artifacts to immutable hashes"],"non_goals":["Do not claim Windows support from a Linux compatibility layer"],"should":["Keep platform-specific behavior behind a tested adapter"]}},"difficulty":"standard","id":"DEV-cross-platform-release-01","planner_input":{"budget":{"planner_tokens":8000,"time_seconds":900,"tool_calls":20},"clarification_oracle":{"allowed_answer_hash":null,"question":null,"required":false},"context_bundle":[{"authority":"authoritative","content":"Plan a release that must preserve byte-stable packaging and pass both Linux and native Windows behavior gates.","kind":"request"},{"authority":"authoritative","content":"Public repository fixture: the release contract covers Linux and native Windows. Compatibility claims require platform-specific receipts; emulation cannot substitute for the native Windows lane, and frozen baseline behavior must remain unchanged when the feature is disabled.","kind":"repository_fact"},{"authority":"authoritative","content":"Do not claim Windows support from a Linux compatibility layer","kind":"constraint"}],"source_snapshots":[{"content":"Public repository fixture: the release contract covers Linux and native Windows. Compatibility claims require platform-specific receipts; emulation cannot substitute for the native Windows lane, and frozen baseline behavior must remain unchanged when the feature is disabled.","immutable":true,"locator":"git+https://github.com/evgyur/chip-supergoal.git@debffb5b9c07d4acdfeaa708c0fbd67358e97632:evals/corpus/sources/cross_platform_release.txt","sha256":"8ce1f6c5dd7f5c18652145798b17a931fd8e743a09ebc0a99970e1874e112f9f"}],"task":"Plan a release that must preserve byte-stable packaging and pass both Linux and native Windows behavior gates."},"privacy_class":"public_repository","schema_version":"eval-case-v2","source_class":"public_repo","split":"development","stratum":"cross_platform_release"}
